{
  "schema_version": "1.0", "receipt_id": "t16-ico-anonymisation-2026-08-02", "status": "acquired",
  "source": {"authority_rank": 3, "publisher": "Information Commissioner's Office", "title": "How do we ensure anonymisation is effective?", "url_or_repository": "https://ico.org.uk/for-organisations/uk-gdpr-guidance-and-resources/data-sharing/anonymisation/how-do-we-ensure-anonymisation-is-effective/", "revision_or_effective_date": "guidance under review following the Data (Use and Access) Act; retrieved 2026-08-02", "locator": "identifiability, motivated intruder, public release"},
  "retrieval": {"retrieved_at": "2026-08-02T12:10:00Z", "method": "HTTPS GET", "http_status": 200, "media_type": "text/html", "etag": null, "last_modified": null},
  "integrity": {"sha256": "76f8701b55582633c9d05a144d0127ace2c0ea3639b3da9aae72c877a84ed8be", "content_length": 134493},
  "rights": {"terms": "Official public regulatory guidance; guidance is under review and is not processing authorization or legal advice.", "permitted_destination": "control requirements, citation, and synthetic tests"},
  "disposition": {"decision": "approve_with_conditions", "rationale": "Supports contextual identifiability assessment, motivated-intruder testing, and stricter review for public release.", "contingency": "Use the stricter current legal and controller rule if guidance changes or conflicts.", "refresh_or_retry_condition": "Refresh on ICO update, law change, audience change, or output/schema change."}
}
